title,author_for_reference,pdf_url,page_no,domain_url,pattern_cleaned_url,github_user_cleaned_url,date,year,eprints_repo
Structural and Dynamical Analysis of 0.1 pc Cores and Filaments in the 30 Doradus-10 Giant Molecular Cloud,R Indebetouw,https://eprints.keele.ac.uk/id/eprint/7853/1/Indebetouw_2020_ApJ_888_56.pdf,3,"https://github.com/indebetouw/FilFinder),",github.com/indebetouw/FilFinder,indebetouw/FilFinder,2020-01-08,2020.0,eprints.keele.ac.uk
"A tutored discourse on microcontrollers, single board computers and their applications to monitor and control chemical reactions",DE Fitzpatrick,https://eprints.keele.ac.uk/id/eprint/7463/1/c9re00407f.pdf,6,https://github.com/python/cpython/,github.com/python/cpython,python/cpython,2020-01-06,2020.0,eprints.keele.ac.uk
Enhancement of Deep Learning in Image Classification Performance Using Xception with the Swish Activation Function for Colorectal Polyp Preliminary Screening,N Jinsakul,https://eprints.keele.ac.uk/id/eprint/7338/1/mathematics-07-01170%20%281%29.pdf,20,https://github.com/fchollet/keras,github.com/fchollet/keras,fchollet/keras,2019-12-03,2019.0,eprints.keele.ac.uk
"Opioid use, post-operative complications, and implant survival after unicompartmental versus total knee replacement: a population-based network study",E Burn,https://eprints.keele.ac.uk/id/eprint/7161/1/D%20Yu%20-%20Opioid%20use%2C%20post-operative%20complications%20and%20implant%20survival.....pdf,4,https://github.com/OHDSI/StudyProtocols/tree/master/UkaTkaSafetyEffectiveness.,github.com/OHDSI/StudyProtocols,OHDSI/StudyProtocols,2019-11-07,2019.0,eprints.keele.ac.uk
Asymptotic Giant Branch Stars in the Nearby Dwarf Galaxy Leo P,SR Goldman,https://eprints.keele.ac.uk/id/eprint/7460/1/Goldman_2019_ApJ_884_152.pdf,5,https://github.com/s-goldman/Dusty-Evolved-Star-Kit,github.com/s-goldman/Dusty-Evolved-Star-Kit,s-goldman/Dusty-Evolved-Star-Kit,2019-10-20,2019.0,eprints.keele.ac.uk
Herschel spectroscopy of Massive Young Stellar Objects in the Magellanic Clouds,JM Oliveira,https://eprints.keele.ac.uk/id/eprint/7037/1/stz2810.pdf,5,https://github.com/keﬂavich/agpy.,github.com/keflavich/agpy,keflavich/agpy,2019-10-09,2019.0,eprints.keele.ac.uk
The intrinsic reddening of the Magellanic Clouds as traced by background galaxies – I. The bar and outskirts of the Small Magellanic Cloud,CPM Bell,https://eprints.keele.ac.uk/id/eprint/6857/1/stz2325.pdf,3,https://github.com/AngusWright/LAMBDAR,github.com/AngusWright/LAMBDAR,AngusWright/LAMBDAR,2019-08-23,2019.0,eprints.keele.ac.uk
The intrinsic reddening of the Magellanic Clouds as traced by background galaxies – I. The bar and outskirts of the Small Magellanic Cloud,CPM Bell,https://eprints.keele.ac.uk/id/eprint/6857/1/stz2325.pdf,4,https://github.com/kbarbary/sfdmap,github.com/kbarbary/sfdmap,kbarbary/sfdmap,2019-08-23,2019.0,eprints.keele.ac.uk
Improved Lifelog Ego-centric Video Summarization Using Ensemble of Deep Learned Object Features,P Mainwaring,https://eprints.keele.ac.uk/id/eprint/7088/1/0003Downloaded.pdf,8,"https://github.com/dresa/photo-quality,",github.com/dresa/photo-quality,dresa/photo-quality,2019-08-05,2019.0,eprints.keele.ac.uk
Towards visualising change-based models,F Polack,https://eprints.keele.ac.uk/id/eprint/6711/1/models-2019.pdf,0,https://github.com/epsilonlabs/emf-cbp,github.com/epsilonlabs/emf-cbp,epsilonlabs/emf-cbp,2019-08-02,2019.0,eprints.keele.ac.uk
Predicting supply chain risks using machine learning: The trade-off between performance and interpretability,G Baryannis,https://eprints.keele.ac.uk/id/eprint/8139/1/2019_FGCS_accepted.pdf,15,https://github.com/gmparg/FGCS-SCRM.,github.com/gmparg/FGCS-SCRM,gmparg/FGCS-SCRM,2019-07-29,2019.0,eprints.keele.ac.uk
TESS Hunt for Young and Maturing Exoplanets (THYME): A Planet in the 45 Myr Tucana–Horologium Association,ER Newton,https://eprints.keele.ac.uk/id/eprint/6665/1/Newton_2019_ApJL_880_L17.pdf,2,https://github.com/ingalls91104/IRACSIM,github.com/ingalls91104/IRACSIM,ingalls91104/IRACSIM,2019-07-20,2019.0,eprints.keele.ac.uk
TESS Hunt for Young and Maturing Exoplanets (THYME): A Planet in the 45 Myr Tucana–Horologium Association,ER Newton,https://eprints.keele.ac.uk/id/eprint/6665/1/Newton_2019_ApJL_880_L17.pdf,3,https://github.com/LCOGT/nres-pipe,github.com/LCOGT/nres-pipe,LCOGT/nres-pipe,2019-07-20,2019.0,eprints.keele.ac.uk
TESS Hunt for Young and Maturing Exoplanets (THYME): A Planet in the 45 Myr Tucana–Horologium Association,ER Newton,https://eprints.keele.ac.uk/id/eprint/6665/1/Newton_2019_ApJL_880_L17.pdf,7,https://github.com/logan-pearce/LOFTI,github.com/logan-pearce/LOFTI,logan-pearce/LOFTI,2019-07-20,2019.0,eprints.keele.ac.uk
TESS Hunt for Young and Maturing Exoplanets (THYME): A Planet in the 45 Myr Tucana–Horologium Association,ER Newton,https://eprints.keele.ac.uk/id/eprint/6665/1/Newton_2019_ApJL_880_L17.pdf,9,https://github.com/captain-exoplanet/misttborn,github.com/captain-exoplanet/misttborn,captain-exoplanet/misttborn,2019-07-20,2019.0,eprints.keele.ac.uk
SBOL-OWL: An ontological approach for formal and semantic representation of synthetic biology information,G Misirli,https://eprints.keele.ac.uk/id/eprint/6313/1/SBOL_OWL.pdf,36,https://github.com/dissys/sbol-owl.,github.com/dissys/sbol-owl,dissys/sbol-owl,2019-07-01,2019.0,eprints.keele.ac.uk
"The mass-loss, expansion velocities and dust production rates of carbon stars in the Magellanic Clouds",A Nanni,https://eprints.keele.ac.uk/id/eprint/6317/1/van-loon-2019-mass-loss-expansion-velocities-dust-production-mnras-aam.pdf,0,https://github.com/s-goldman/Dusty-Evolved-Star-Kit.,github.com/s-goldman/Dusty-Evolved-Star-Kit,s-goldman/Dusty-Evolved-Star-Kit,2019-07-01,2019.0,eprints.keele.ac.uk
Towards Efficient Comparison of Change-Based Models,F Polack,https://eprints.keele.ac.uk/id/eprint/6248/1/ECMFA_2019___Journal_of_Object_Technology.pdf,4,https://github.com/epsilonlabs/emf-cbp.,github.com/epsilonlabs/emf-cbp,epsilonlabs/emf-cbp,2019-07-01,2019.0,eprints.keele.ac.uk
Scalability performance measurement and testing of cloud-based software services,A Al-Said Ahmad,https://eprints.keele.ac.uk/id/eprint/6755/1/Al-SaidAhmadPhD2019.pdf,203,https://github.com/orangehrm/orangehrm.,github.com/orangehrm/orangehrm,orangehrm/orangehrm,2019-06-01,2019.0,eprints.keele.ac.uk
Scalability performance measurement and testing of cloud-based software services,A Al-Said Ahmad,https://eprints.keele.ac.uk/id/eprint/6755/1/Al-SaidAhmadPhD2019.pdf,205,https://github.com/netflix/chaosmonkey.,github.com/netflix/chaosmonkey,netflix/chaosmonkey,2019-06-01,2019.0,eprints.keele.ac.uk
Detection and characterisation of stellar companions to transiting extrasolar planets through high resolution imaging,Daniel Fred Evans,https://eprints.keele.ac.uk/id/eprint/6481/1/EvansPhD2019.pdf,6,https://github.com/avigan/VLTPF,github.com/avigan/VLTPF,avigan/VLTPF,2019-06-01,2019.0,eprints.keele.ac.uk
Evaluation of Structured Light Plethysmography for lung function monitoring in pediatric respiratory disorders,Hamzah Hmeidi,https://eprints.keele.ac.uk/id/eprint/6457/1/HmeidiPhD2019.pdf,179,https://github.com/jameslyons/spl_featgen,github.com/jameslyons/spl_featgen,jameslyons/spl_featgen,2019-06-01,2019.0,eprints.keele.ac.uk
‘Lowering your standards’?: assessing the procedural legitimacy of the World Wide Web Consortium (W3C),Scott Mason,https://eprints.keele.ac.uk/id/eprint/6489/1/MasonPhD2019.pdf,130,https://github.com/datactive/bigbang.,github.com/datactive/bigbang,datactive/bigbang,2019-06-01,2019.0,eprints.keele.ac.uk
"The impact of pelvic lateral rotation on hindlimb kinematics and stride length in the red-legged running frog, Kassina maculata.",AJ Collings,https://eprints.keele.ac.uk/id/eprint/10832/1/The%20impact%20of%20pelvic%20lateral%20rotation%20on%20hindlimb%20kinematics%20and%20stride%20length%20in%20the%20red-legged%20running%20frog%2C%20iKassina%20macu.pdf,15,https://github.com/frogtronics/pelvicKinematics.,github.com/frogtronics/pelvicKinematics,frogtronics/pelvicKinematics,2019-05-08,2019.0,eprints.keele.ac.uk
OGLE-2014-BLG-1186: gravitational microlensing providing evidence for a planet orbiting the foreground star or for a close binary source?,D Starkey,https://eprints.keele.ac.uk/id/eprint/6180/1/starkey-2019-OGLE-2014-BLG-1186-mnras.pdf,3,https://github.com/ebachelet/RoboNoise,github.com/ebachelet/RoboNoise,ebachelet/RoboNoise,2019-04-01,2019.0,eprints.keele.ac.uk
Harmonizing semantic annotations for computational models in biology,ML Neal,https://eprints.keele.ac.uk/id/eprint/8788/1/Harmonizing%20Semantic%20Annotations.pdf,3,"https://github.com/SemBioProcess/SemGen),",github.com/SemBioProcess/SemGen,SemBioProcess/SemGen,2019-03-01,2019.0,eprints.keele.ac.uk
Harmonizing semantic annotations for computational models in biology,ML Neal,https://eprints.keele.ac.uk/id/eprint/8788/1/Harmonizing%20Semantic%20Annotations.pdf,6,https://github.com/combine-org/Annotations).,github.com/combine-org/Annotations,combine-org/Annotations,2019-03-01,2019.0,eprints.keele.ac.uk
Harmonizing semantic annotations for computational models in biology,ML Neal,https://eprints.keele.ac.uk/id/eprint/8788/1/Harmonizing%20Semantic%20Annotations.pdf,7,https://github.com/opencobra/memote),github.com/opencobra/memote,opencobra/memote,2019-03-01,2019.0,eprints.keele.ac.uk
Fundamental parameters of subgiant stars in detached eclipsing binary systems,Jessica Ann Evans,https://eprints.keele.ac.uk/id/eprint/6059/1/EvansPhD2019.pdf,48,https://github.com/astropy/astroscrappy,github.com/astropy/astroscrappy,astropy/astroscrappy,2019-03-01,2019.0,eprints.keele.ac.uk
SB 796: a high-velocity RRc star,R Gomel,https://eprints.keele.ac.uk/id/eprint/5504/1/20181114_ty2828.pdf,14,http://github.com/jobovy/galpy,github.com/jobovy/galpy,jobovy/galpy,2019-02-01,2019.0,eprints.keele.ac.uk
Does Task Activation in Task Switching Influence Inhibition or Episodic Interference?,JA Grange,https://eprints.keele.ac.uk/id/eprint/5714/1/Grange%20%282018%29%20-%20RCI%20episodic%20preprint.pdf,22,https://github.com/crsh/papaja,github.com/crsh/papaja,crsh/papaja,2019-01-14,2019.0,eprints.keele.ac.uk
The effect of practice on inhibition in task switching: Controlling for episodic retrieval,JA Grange,https://eprints.keele.ac.uk/id/eprint/5715/1/Grange%20et%20al.%20%282019%29%20-%20practice%20preprint.pdf,28,https://github.com/crsh/papaja,github.com/crsh/papaja,crsh/papaja,2019-01-01,2019.0,eprints.keele.ac.uk
"Study on automatic citation screening in systematic reviews: reporting, reproducibility and complexity",Babatunde Kazeem Olorisade,https://eprints.keele.ac.uk/id/eprint/6073/1/OlorisadePhD2019.pdf,95,https://github.com/raylite/reproducibility-data,github.com/raylite/reproducibility-data,raylite/reproducibility-data,2019-01-01,2019.0,eprints.keele.ac.uk
Deciphering the atmosphere of HAT-P-12b: solving discrepant results,X Alexoudi,https://eprints.keele.ac.uk/id/eprint/5607/1/aa33691-18.pdf,3,https://github.com/sczesla/PyAstronomy,github.com/sczesla/PyAstronomy,sczesla/PyAstronomy,2018-12-10,2018.0,eprints.keele.ac.uk
A Genetic Circuit Compiler: Generating Combinatorial Genetic Circuits with Web Semantics and Inference,G Misirli,https://eprints.keele.ac.uk/id/eprint/5495/1/acssynbio.8b00201.pdf,27,https://github.com/rulebased/rbmo,github.com/rulebased/rbmo,rulebased/rbmo,2018-12-01,2018.0,eprints.keele.ac.uk
A Genetic Circuit Compiler: Generating Combinatorial Genetic Circuits with Web Semantics and Inference,G Misirli,https://eprints.keele.ac.uk/id/eprint/5495/1/acssynbio.8b00201.pdf,27,https://github.com/rulebased/composition,github.com/rulebased/composition,rulebased/composition,2018-12-01,2018.0,eprints.keele.ac.uk
A Genetic Circuit Compiler: Generating Combinatorial Genetic Circuits with Web Semantics and Inference,G Misirli,https://eprints.keele.ac.uk/id/eprint/5495/1/acssynbio.8b00201.pdf,27,https://github.com/sstucki/lms-kappa,github.com/sstucki/lms-kappa,sstucki/lms-kappa,2018-12-01,2018.0,eprints.keele.ac.uk
Detection of suspicious URLs in online social networks using supervised machine learning algorithms,Mohammed Fadhil Zamil Al-Janabi,https://eprints.keele.ac.uk/id/eprint/5581/1/Al-JanabiPhD2018.pdf,26,https://github.com/mohfadhil/suspectrate-,github.com/mohfadhil/suspectrate-,mohfadhil/suspectrate-datasets,2018-12-01,2018.0,eprints.keele.ac.uk
Detection of suspicious URLs in online social networks using supervised machine learning algorithms,Mohammed Fadhil Zamil Al-Janabi,https://eprints.keele.ac.uk/id/eprint/5581/1/Al-JanabiPhD2018.pdf,28,https://github.com/mohfadhil/suspectrate.,github.com/mohfadhil/suspectrate,mohfadhil/suspectrate-datasets,2018-12-01,2018.0,eprints.keele.ac.uk
Detection of suspicious URLs in online social networks using supervised machine learning algorithms,Mohammed Fadhil Zamil Al-Janabi,https://eprints.keele.ac.uk/id/eprint/5581/1/Al-JanabiPhD2018.pdf,54,https://github.com/dmlc/xgboost,github.com/dmlc/xgboost,dmlc/xgboost,2018-12-01,2018.0,eprints.keele.ac.uk
Detection of suspicious URLs in online social networks using supervised machine learning algorithms,Mohammed Fadhil Zamil Al-Janabi,https://eprints.keele.ac.uk/id/eprint/5581/1/Al-JanabiPhD2018.pdf,102,https://github.com/HIPS/Spearmint,github.com/HIPS/Spearmint,HIPS/Spearmint,2018-12-01,2018.0,eprints.keele.ac.uk
NuGrid Stellar Data Set. II. Stellar Yields from H to Bi for Stellar Models with MZAMS = 1 to 25 M⊙ and Z = 0.0001 to 0.02,C Ritter,https://eprints.keele.ac.uk/id/eprint/5149/1/20180725_mnras_sty1729.pdf,55,https://github.com/NuGrid/NuGridPy.,github.com/NuGrid/NuGridPy,NuGrid/NuGridPy,2018-10-11,2018.0,eprints.keele.ac.uk
Reproducibility of Studies on Text Mining for Citation Screening in Systematic Reviews: Evaluation and Checklist,BK Olorisade,https://eprints.keele.ac.uk/id/eprint/3752/1/Manuscript%20-%20Final%20-%20Submitted.pdf,13,https://github.com/raylite/reproducibility-data,github.com/raylite/reproducibility-data,raylite/reproducibility-data,2018-09-01,2018.0,eprints.keele.ac.uk
Unmasking the hidden NGTS-3Ab: a hot Jupiter in an unresolved binary system,MN Günther,https://eprints.keele.ac.uk/id/eprint/4896/1/11052018_smalley_sty1193.pdf,22,"https://github.com/sczesla/PyAstronomy),",github.com/sczesla/PyAstronomy,sczesla/PyAstronomy,2018-08-21,2018.0,eprints.keele.ac.uk
The Gaia-ESO Survey: a kinematical and dynamical study of four young open clusters,L Bravi,https://eprints.keele.ac.uk/id/eprint/5422/1/aa32645-18.pdf,6,https://github.com/eleonorazari/KinematicModelling.,github.com/eleonorazari/KinematicModelling,eleonorazari/KinematicModelling,2018-07-06,2018.0,eprints.keele.ac.uk
The VMC survey XXVIII. Improved measurements of the proper motion of the Galactic globular cluster 47 Tucanae,F Niederhofer,https://eprints.keele.ac.uk/id/eprint/4916/1/20180517_vl_aav3.pdf,10,http://github.com/jobovy/galpy,github.com/jobovy/galpy,jobovy/galpy,2018-05-08,2018.0,eprints.keele.ac.uk
Helium in the eroding atmosphere of an exoplanet,JJ Spake,https://eprints.keele.ac.uk/id/eprint/4919/1/20180517_heic1809a.pdf,28,https://github.com/lkreidberg/batman),github.com/lkreidberg/batman,lkreidberg/batman,2018-05-02,2018.0,eprints.keele.ac.uk
"The discovery of WASP-151b, WASP-153b, WASP-156b: Insights on giant planet migration and the upper boundary of the Neptunian desert",ODS Demangeon,https://eprints.keele.ac.uk/id/eprint/4699/1/03042018_aa31735-17.pdf,5,"https://github.com/dfm/emcee,",github.com/dfm/emcee,dfm/emcee,2018-03-02,2018.0,eprints.keele.ac.uk
"The discovery of WASP-151b, WASP-153b, WASP-156b: Insights on giant planet migration and the upper boundary of the Neptunian desert",ODS Demangeon,https://eprints.keele.ac.uk/id/eprint/4699/1/03042018_aa31735-17.pdf,5,https://github.com/hpparvi/ldtk,github.com/hpparvi/ldtk,hpparvi/ldtk,2018-03-02,2018.0,eprints.keele.ac.uk
An open-source approach to automation in organic synthesis: The flow chemical formation of benzamides using an inline liquid-liquid extraction system and a homemade 3-axis autosampling/product-collection device,M O'Brien,https://eprints.keele.ac.uk/id/eprint/5061/1/M%20O%27Brien%20-%20An%20open-source%20approach%20to%20automation%20in%20organic%20synthesis.pdf,12,https://github.com/richardingham/octopus/,github.com/richardingham/octopus,richardingham/octopus,2018-02-21,2018.0,eprints.keele.ac.uk
Meta-QSAR: a large-scale application of meta-learning to drug design and discovery.,I Olier,https://eprints.keele.ac.uk/id/eprint/5670/1/I%20Olier%20-%20Meta-QSAR....pdf,12,https://github.com/larisa-soldatova/meta-qsar.,github.com/larisa-soldatova/meta-qsar,larisa-soldatova/meta-qsar,2017-12-22,2017.0,eprints.keele.ac.uk
Meta-QSAR: a large-scale application of meta-learning to drug design and discovery.,I Olier,https://eprints.keele.ac.uk/id/eprint/5670/1/I%20Olier%20-%20Meta-QSAR....pdf,12,https://github.com/meta-QSAR/drug-target-descriptors.,github.com/meta-QSAR/drug-target-descriptors,meta-QSAR/drug-target-descriptors,2017-12-22,2017.0,eprints.keele.ac.uk
Meta-QSAR: a large-scale application of meta-learning to drug design and discovery.,I Olier,https://eprints.keele.ac.uk/id/eprint/5670/1/I%20Olier%20-%20Meta-QSAR....pdf,16,https://github.com/meta-QSAR/simple-tree.,github.com/meta-QSAR/simple-tree,meta-QSAR/simple-tree,2017-12-22,2017.0,eprints.keele.ac.uk
Automatic Detection and Distinction of Retinal Vessel Bifurcations and Crossings in Colour Fundus Photography,H Pratt,https://eprints.keele.ac.uk/id/eprint/11221/1/jimaging-04-00004-v2.pdf,13,https://github.com/fchollet/keras,github.com/fchollet/keras,fchollet/keras,2017-12-22,2017.0,eprints.keele.ac.uk
Turning Models Inside Out,FAC Polack,https://eprints.keele.ac.uk/id/eprint/4787/1/F%20Polack%20-%20Turning%20Models%20Inside%20Out.pdf,2,https://github.com/epsilonlabs/emf-cbp.,github.com/epsilonlabs/emf-cbp,epsilonlabs/emf-cbp,2017-12-19,2017.0,eprints.keele.ac.uk
An automated colorimetric inline titration of CO2 concentrations in solvent flow streams using a Teflon AF-2400 tube-in-tube device,M O’Brien,https://eprints.keele.ac.uk/id/eprint/4700/1/M_O%27BRIEN_automated-colorimetric-titration-flow-CO2.pdf,20,https://github.com/pyserial/pyserial,github.com/pyserial/pyserial,pyserial/pyserial,2017-10-01,2017.0,eprints.keele.ac.uk
Multiscale sequential convolutional neural networks for simultaneous detection of fovea and optic disc,B Al-Bander,https://eprints.keele.ac.uk/id/eprint/11215/1/1-s2.0-S1746809417302173-main.pdf,10,https://github.com/Lasagne/Lasagne,github.com/Lasagne/Lasagne,Lasagne/Lasagne,2017-09-23,2017.0,eprints.keele.ac.uk
Multiscale sequential convolutional neural networks for simultaneous detection of fovea and optic disc,B Al-Bander,https://eprints.keele.ac.uk/id/eprint/11215/1/1-s2.0-S1746809417302173-main.pdf,10,https://github.com/Theano/Theano.,github.com/Theano/Theano,Theano/Theano,2017-09-23,2017.0,eprints.keele.ac.uk
Using supervised machine learning algorithms to detect suspicious URLs in online social networks,MF Al-Janabi,https://eprints.keele.ac.uk/id/eprint/3676/1/FOSINT-SI_2017_paper_27.pdf,3,https://github.com/adblockplus/python-abp,github.com/adblockplus/python-abp,adblockplus/python-abp,2017-06-21,2017.0,eprints.keele.ac.uk
Harnessing open-source technology for low-cost automation in synthesis: flow chemical deprotection of silyl ethers using a homemade autosampling system.,M O'Brien,https://eprints.keele.ac.uk/id/eprint/3503/1/M%20OBrien%20-%20Harnessing%20open-source%20technology%20for%20low-cost%20automation%20in%20synthesis%20-%20flow%20chemical%20deprotection%20of%20silyl%20ethers%20using%20a%20homemade%20autosampling%20system.pdf,6,https://github.com/pyserial/pyserial,github.com/pyserial/pyserial,pyserial/pyserial,2017-05-05,2017.0,eprints.keele.ac.uk
The Intermediate r-process in Core-collapse Supernovae Driven by the Magneto-rotational Instability,N Nishimura,https://eprints.keele.ac.uk/id/eprint/9776/1/Nishimura__2017_ApJL_836_L21.pdf,5,http://github.com/nnobuya/mrsn.,github.com/nnobuya/mrsn,nnobuya/mrsn,2017-02-16,2017.0,eprints.keele.ac.uk
The continuous-flow synthesis of carbazate hydrazones using a simplified computer-vision controlled liquid-liquid extraction system,M O'Brien,https://eprints.keele.ac.uk/id/eprint/3505/1/M%20OBrien%20-%20The%20continuous%20flow%20synthesis%20of%20carbazate%20hydrazones%20using%20a%20simplified%20computer-vision%20controlled%20liquid%20liquid%20extraction%20system.pdf,4,"https://github.com/pyserial/pyserial,",github.com/pyserial/pyserial,pyserial/pyserial,2016-10-10,2016.0,eprints.keele.ac.uk
Genetic and behavioural mechanisms of reproductive isolation and speciation in recently-diverged sibling species of the malaria vector Anopheles gambiae s.l.,Nahla Alhafez,https://eprints.keele.ac.uk/id/eprint/3211/1/AlhafezPhD2016.pdf,229,https://github.com/najoshi/sickle.,github.com/najoshi/sickle,najoshi/sickle,2016-10-01,2016.0,eprints.keele.ac.uk
Weather-Based Optimal Power Flow With Wind Farms Integration,J Cao,https://eprints.keele.ac.uk/id/eprint/6123/7/cao-Weather-Based%20Optimal%20Power%20Flow%20with%20wind%20farm%20integration-revised.pdf,7,https://github.com/TDPF/TDPF.,github.com/TDPF/TDPF,TDPF/TDPF,2016-07-01,2016.0,eprints.keele.ac.uk
An irradiated brown-dwarf companion to an accreting white dwarf,JV Santisteban,https://eprints.keele.ac.uk/id/eprint/1844/1/xxx160507132-Hernandez-NaturePaper.pdf,9,https://github.com/bretonr/Icarus.,github.com/bretonr/Icarus,bretonr/Icarus,2016-05-19,2016.0,eprints.keele.ac.uk
Characterization of Genetic Variability of Venezuelan Equine Encephalitis Viruses.,SN Gardner,https://eprints.keele.ac.uk/id/eprint/7702/1/journal.pone.0152604.PDF,4,https://github.com/stamatak/Parsimonator-1.0.2).,github.com/stamatak/Parsimonator-,stamatak/Parsimonator-1.0.2,2016-04-07,2016.0,eprints.keele.ac.uk
An evaluation of digital interfaces for music composition and improvisation,Konstantinos Vasilakos,https://eprints.keele.ac.uk/id/eprint/1606/1/Vasilakos%20PhD%202016.pdf,44,https://github.com/blacksound/SCFirmata,github.com/blacksound/SCFirmata,blacksound/SCFirmata,2016-03-01,2016.0,eprints.keele.ac.uk
An evaluation of digital interfaces for music composition and improvisation,Konstantinos Vasilakos,https://eprints.keele.ac.uk/id/eprint/1606/1/Vasilakos%20PhD%202016.pdf,81,https://github.com/supercollider-quarks/ixiViews,github.com/supercollider-quarks/ixiViews,supercollider-quarks/ixiViews,2016-03-01,2016.0,eprints.keele.ac.uk
An evaluation of digital interfaces for music composition and improvisation,Konstantinos Vasilakos,https://eprints.keele.ac.uk/id/eprint/1606/1/Vasilakos%20PhD%202016.pdf,87,https://github.com/KonVas/Ionio-liveCode-workshop,github.com/KonVas/Ionio-liveCode-workshop,KonVas/Ionio-liveCode-workshop,2016-03-01,2016.0,eprints.keele.ac.uk
An evaluation of digital interfaces for music composition and improvisation,Konstantinos Vasilakos,https://eprints.keele.ac.uk/id/eprint/1606/1/Vasilakos%20PhD%202016.pdf,99,https://github.com/muellmusik/Utopia>,github.com/muellmusik/Utopia,muellmusik/Utopia,2016-03-01,2016.0,eprints.keele.ac.uk
Modelling conditions and health care processes in electronic health records: an application to severe mental illness with the clinical practice research datalink,I Olier,https://eprints.keele.ac.uk/id/eprint/1508/1/olier_plos1_feb16.pdf,4,https://github.com/rOpenHealth/rpcdsearch).,github.com/rOpenHealth/rpcdsearch,rOpenHealth/rpcdsearch,2016-02-26,2016.0,eprints.keele.ac.uk
"Heterosis Increases Fertility, Fecundity and Survival of Laboratory-Produced F1 Hybrid Males of the Malaria Mosquito Anopheles coluzzii",NE Ekechukwu,https://eprints.keele.ac.uk/id/eprint/1284/1/F%20Tripet%20-%20Heterosis%20increases%20fertility%2C%20fecundity%20and%20survival%20of%20laboratory-produced%20F1%20hybrid%20males%20of%20the%20malaria%20mosquito%20anopheles%20coluzzi.pdf,15,https://github.com/najoshi/sickle.,github.com/najoshi/sickle,najoshi/sickle,2015-12-09,2015.0,eprints.keele.ac.uk
From raw data to data-analysis for magnetic resonance spectroscopy – the missing link: jMRUI2XML,V Mocioiu,https://eprints.keele.ac.uk/id/eprint/1124/1/olier_s12859-015-0796-5.pdf,10,https://github.com/nmrML/nmrML],github.com/nmrML/nmrML,nmrML/nmrML,2015-11-09,2015.0,eprints.keele.ac.uk
flankr: An R package implementing computational models of attentional selectivity.,JA Grange,https://eprints.keele.ac.uk/id/eprint/1664/1/Grange%20%28flankr%29.pdf,8,https://github.com/JimGrange/ﬂankr,github.com/JimGrange/flankr,JimGrange/flankr,2015-07-15,2015.0,eprints.keele.ac.uk
Stellar parameters of early-M dwarfs from ratios of spectral features at optical wavelengths,J Maldonado,https://eprints.keele.ac.uk/id/eprint/1129/1/Stellar%20Parameters%20of%20early-M%20dwarfs%20from%20ratios%20of%20spectral%20features%20at%20optical%20wavelengths.pdf,9,https://github.com/PACurran/MCSpearman/,github.com/PACurran/MCSpearman,PACurran/MCSpearman,2015-05-18,2015.0,eprints.keele.ac.uk
Experimental swap of anopheles gambiae's assortative mating preferences demonstrates key role of X-chromosome divergence island in incipient sympatric speciation,F Tripet,https://eprints.keele.ac.uk/id/eprint/418/1/Frederic%20Tripet%20-%20Experitmental%20swap%20of%20anopheles%20gambiaes%20assortive....pdf,18,https://github.com/najoshi/sickle,github.com/najoshi/sickle,najoshi/sickle,2015-04-16,2015.0,eprints.keele.ac.uk
Composable Modular Models for Synthetic Biology.,G Misirli,https://eprints.keele.ac.uk/id/eprint/3653/1/G%20Misirili%20-%20Composable%20Modular%20Models%20for%20Synthetic%20Biologu.pdf,8,https://github.com/SynBioDex/libSBOLj.,github.com/SynBioDex/libSBOLj,SynBioDex/libSBOLj,2014-12-03,2014.0,eprints.keele.ac.uk
The second data release of the INT Photometric Hα Survey of the Northern Galactic Plane (IPHAS DR2),G Barentsen,https://eprints.keele.ac.uk/id/eprint/2623/1/MNRAS-2014-Barentsen-3230-57.pdf,22,https://github.com/barentsen/iphas-dr2.,github.com/barentsen/iphas-dr,barentsen/iphas-dr2,2014-09-15,2014.0,eprints.keele.ac.uk
