title,author_for_reference,pdf_url,page_no,domain_url,pattern_cleaned_url,github_user_cleaned_url,date,year,eprints_repo
"KiDS+GAMA: cosmology constraints from a joint analysis of cosmic shear, galaxy–galaxy lensing, and angular clustering",E van Uitert,https://researchonline.ljmu.ac.uk/id/eprint/13342/1/KiDS%2BGAMA%20cosmology%20constraints%20from%20a%20joint%20analysis%20of%20cosmic%20shear%2C%20galaxy%E2%80%93galaxy%20lensing%2C%20and%20angular%20clustering.pdf,11,https://github.com/sjoudaki/CosmoLSS,github.com/sjoudaki/CosmoLSS,sjoudaki/CosmoLSS,2018-03-14,2018.0,researchonline.ljmu.ac.uk
Security Policy Monitoring of BPMN-based Service Compositions,M Asim,https://researchonline.ljmu.ac.uk/id/eprint/7862/1/Security%20Policy%20Monitoring%20of%20BPMN-based%20Service%20Compositions%20-Accepted%20Version.pdf,12,https://github.com/AniketosEU/Security-Monitoring-and-,github.com/AniketosEU/Security-Monitoring-and-,AniketosEU/Security-Monitoring-and-Notification,2018-02-22,2018.0,researchonline.ljmu.ac.uk
ENTICE VM image analysis and optimised fragmentation,G Kecskemeti,https://researchonline.ljmu.ac.uk/id/eprint/7977/1/GRID-D-17-00098_R3.pdf,24,https://github.com/rkt/rkt,github.com/rkt/rkt,rkt/rkt,2018-02-21,2018.0,researchonline.ljmu.ac.uk
The BAHAMAS project: the CMB--large-scale structure tension and the roles of massive neutrinos and galaxy formation,IG McCarthy,https://researchonline.ljmu.ac.uk/id/eprint/7743/7/sty377.pdf,7,https://github.com/sbird/S-GenIC,github.com/sbird/S-GenIC,sbird/S-GenIC,2018-02-13,2018.0,researchonline.ljmu.ac.uk
The BAHAMAS project: the CMB--large-scale structure tension and the roles of massive neutrinos and galaxy formation,IG McCarthy,https://researchonline.ljmu.ac.uk/id/eprint/7743/7/sty377.pdf,19,https://github.com/sjoudaki/cfhtlens_revisited,github.com/sjoudaki/cfhtlens_revisited,sjoudaki/cfhtlens_revisited,2018-02-13,2018.0,researchonline.ljmu.ac.uk
SN 2017dio: A Type-Ic Supernova Exploding in a Hydrogen-rich Circumstellar Medium,H Kuncarayakti,https://researchonline.ljmu.ac.uk/id/eprint/8300/14/SN%202017dio%20A%20Type-Ic%20Supernova%20Exploding%20in%20a%20Hydrogen-rich%20Circumstellar%20Medium.pdf,4,https://github.com/svalenti/pessto,github.com/svalenti/pessto,svalenti/pessto,2018-02-09,2018.0,researchonline.ljmu.ac.uk
Distributed star formation throughout the Galactic Center cloud Sgr B2,AG Ginsburg,https://researchonline.ljmu.ac.uk/id/eprint/7874/16/Distributed%20star%20formation%20throughout%20the%20Galactic%20Center%20cloud%20Sgr%20B2.pdf,8,https://github.com/radio-astro-tools/uvcombine,github.com/radio-astro-tools/uvcombine,radio-astro-tools/uvcombine,2018-02-05,2018.0,researchonline.ljmu.ac.uk
The proBAM and proBed standard formats: enabling a seamless integration of genomics and proteomics data,G Menschaert,https://researchonline.ljmu.ac.uk/id/eprint/11511/1/The%20proBAM%20and%20proBed%20standard%20formats%20enabling%20a%20seamless%20integration%20of%20genomics%20and%20proteomics%20data.pdf,6,"https://github.com/PRIDE-Toolsuite/PGConverter),",github.com/PRIDE-Toolsuite/PGConverter,PRIDE-Toolsuite/PGConverter,2018-01-31,2018.0,researchonline.ljmu.ac.uk
The proBAM and proBed standard formats: enabling a seamless integration of genomics and proteomics data,G Menschaert,https://researchonline.ljmu.ac.uk/id/eprint/11511/1/The%20proBAM%20and%20proBed%20standard%20formats%20enabling%20a%20seamless%20integration%20of%20genomics%20and%20proteomics%20data.pdf,6,"https://github.com/statgen/bamUtil),",github.com/statgen/bamUtil,statgen/bamUtil,2018-01-31,2018.0,researchonline.ljmu.ac.uk
The First Post-Kepler Brightness Dips of KIC 8462852,TS Boyajian,https://researchonline.ljmu.ac.uk/id/eprint/7781/1/1801.00732v1.pdf,19,https://github.com/LCOGT/banzai,github.com/LCOGT/banzai,LCOGT/banzai,2018-01-19,2018.0,researchonline.ljmu.ac.uk
The First Post-Kepler Brightness Dips of KIC 8462852,TS Boyajian,https://researchonline.ljmu.ac.uk/id/eprint/7781/1/1801.00732v1.pdf,20,https://github.com/ishivvers/TheKastShiv,github.com/ishivvers/TheKastShiv,ishivvers/TheKastShiv,2018-01-19,2018.0,researchonline.ljmu.ac.uk
Confirming chemical clocks: asteroseismic age dissection of the Milky Way disk(s),VS Aguirre,https://researchonline.ljmu.ac.uk/id/eprint/7893/1/1710.09847v2.pdf,11,http://github.com/jobovy/galpy,github.com/jobovy/galpy,jobovy/galpy,2018-01-18,2018.0,researchonline.ljmu.ac.uk
Meta-QSAR: a large-scale application of meta-learning to drug design and discovery,I Olier,https://researchonline.ljmu.ac.uk/id/eprint/8700/11/Meta-QSAR%20a%20large-scale%20application%20of%20meta-learning%20to%20drug%20design%20and%20discovery.pdf,13,https://github.com/larisa-soldatova/meta-qsar.,github.com/larisa-soldatova/meta-qsar,larisa-soldatova/meta-qsar,2017-12-22,2017.0,researchonline.ljmu.ac.uk
Meta-QSAR: a large-scale application of meta-learning to drug design and discovery,I Olier,https://researchonline.ljmu.ac.uk/id/eprint/8700/11/Meta-QSAR%20a%20large-scale%20application%20of%20meta-learning%20to%20drug%20design%20and%20discovery.pdf,13,https://github.com/meta-QSAR/drug-target-descriptors.,github.com/meta-QSAR/drug-target-descriptors,meta-QSAR/drug-target-descriptors,2017-12-22,2017.0,researchonline.ljmu.ac.uk
Meta-QSAR: a large-scale application of meta-learning to drug design and discovery,I Olier,https://researchonline.ljmu.ac.uk/id/eprint/8700/11/Meta-QSAR%20a%20large-scale%20application%20of%20meta-learning%20to%20drug%20design%20and%20discovery.pdf,17,https://github.com/meta-QSAR/simple-tree.,github.com/meta-QSAR/simple-tree,meta-QSAR/simple-tree,2017-12-22,2017.0,researchonline.ljmu.ac.uk
"iPTF 16asu: A Luminous, Rapidly Evolving, and High-velocity Supernova",L Whitesides,https://researchonline.ljmu.ac.uk/id/eprint/8094/8/iPTF%2016asu%20A%20Luminous%2C%20Rapidly%20Evolving%2C%20and%20High-velocity%20Supernova.pdf,15,https://github.com/nyusngroup/SESNspectraLib.,github.com/nyusngroup/SESNspectraLib,nyusngroup/SESNspectraLib,2017-12-18,2017.0,researchonline.ljmu.ac.uk
Impaired path integration in mice with disrupted grid cell firing,M Gill,https://researchonline.ljmu.ac.uk/id/eprint/12321/8/Impaired%20path%20integration%20in%20mice%20with%20disrupted%20grid%20cell%20firing.pdf,14,https://github.com/klusta-team/klustakwik),github.com/klusta-team/klustakwik,klusta-team/klustakwik,2017-12-11,2017.0,researchonline.ljmu.ac.uk
Environmental DNA reveals tropical shark diversity in contrasting levels of anthropogenic impact,J Bakker,https://researchonline.ljmu.ac.uk/id/eprint/12411/1/Environmental%20DNA%20reveals%20tropical%20shark%20diversity%20in%20contrasting%20levels%20of%20anthropogenic%20impact.pdf,8,http://github.com/metabarpark/Reference-databases.,github.com/metabarpark/Reference-databases,metabarpark/Reference-databases,2017-12-04,2017.0,researchonline.ljmu.ac.uk
Gas inflow and outflow in an interacting high-redshift galaxy The remarkable host environment of GRB 080810 at z=3.35,P Wiseman,https://researchonline.ljmu.ac.uk/id/eprint/8096/1/Wiseman_2017_AA_607_107.pdf,2,https://github.com/profxj/xidl,github.com/profxj/xidl,profxj/xidl,2017-11-22,2017.0,researchonline.ljmu.ac.uk
Star formation in a high-pressure environment: An SMA view of the Galactic centre dust ridge,DL Walker,https://researchonline.ljmu.ac.uk/id/eprint/7529/15/Star%20formation%20in%20a%20high-pressure%20environment%20An%20SMA%20view%20of%20the%20Galactic%20centre%20dust%20ridge.pdf,13,https://github.com/xinglunju/FFTL.,github.com/xinglunju/FFTL,xinglunju/FFTL,2017-11-13,2017.0,researchonline.ljmu.ac.uk
KiDS-450 + 2dFLenS: Cosmological parameter constraints from weak gravitational lensing tomography and overlapping redshift-space galaxy clustering,S Joudaki,https://researchonline.ljmu.ac.uk/id/eprint/13343/1/KiDS-450%20%2B%202dFLenS%20Cosmological%20parameter%20constraints%20from%20weak%20gravitational%20lensing%20tomography%20and%20overlapping%20redshift-space%20galaxy%20clustering.pdf,10,https://github.com/sjoudaki/cfhtlens_revisited,github.com/sjoudaki/cfhtlens_revisited,sjoudaki/cfhtlens_revisited,2017-10-31,2017.0,researchonline.ljmu.ac.uk
KiDS-450 + 2dFLenS: Cosmological parameter constraints from weak gravitational lensing tomography and overlapping redshift-space galaxy clustering,S Joudaki,https://researchonline.ljmu.ac.uk/id/eprint/13343/1/KiDS-450%20%2B%202dFLenS%20Cosmological%20parameter%20constraints%20from%20weak%20gravitational%20lensing%20tomography%20and%20overlapping%20redshift-space%20galaxy%20clustering.pdf,10,https://github.com/sjoudaki/kids450,github.com/sjoudaki/kids,sjoudaki/kids450,2017-10-31,2017.0,researchonline.ljmu.ac.uk
KiDS-450 + 2dFLenS: Cosmological parameter constraints from weak gravitational lensing tomography and overlapping redshift-space galaxy clustering,S Joudaki,https://researchonline.ljmu.ac.uk/id/eprint/13343/1/KiDS-450%20%2B%202dFLenS%20Cosmological%20parameter%20constraints%20from%20weak%20gravitational%20lensing%20tomography%20and%20overlapping%20redshift-space%20galaxy%20clustering.pdf,10,https://github.com/sjoudaki/CosmoLSS.,github.com/sjoudaki/CosmoLSS,sjoudaki/CosmoLSS,2017-10-31,2017.0,researchonline.ljmu.ac.uk
KiDS-450 + 2dFLenS: Cosmological parameter constraints from weak gravitational lensing tomography and overlapping redshift-space galaxy clustering,S Joudaki,https://researchonline.ljmu.ac.uk/id/eprint/13343/1/KiDS-450%20%2B%202dFLenS%20Cosmological%20parameter%20constraints%20from%20weak%20gravitational%20lensing%20tomography%20and%20overlapping%20redshift-space%20galaxy%20clustering.pdf,10,https://github.com/alexander-mead/hmcode,github.com/alexander-mead/hmcode,alexander-mead/hmcode,2017-10-31,2017.0,researchonline.ljmu.ac.uk
Genomic Analyses of Pre-European Conquest Human Remains from the Canary Islands Reveal Close Affinity to Modern North Africans,R Rodríguez-Varela,https://researchonline.ljmu.ac.uk/id/eprint/7546/7/Genomic%20Analyses%20of%20Pre-European%20Conquest.pdf,11,https://github.com/pontussk/popstats,github.com/pontussk/popstats,pontussk/popstats,2017-10-26,2017.0,researchonline.ljmu.ac.uk
Genomic Analyses of Pre-European Conquest Human Remains from the Canary Islands Reveal Close Affinity to Modern North Africans,R Rodríguez-Varela,https://researchonline.ljmu.ac.uk/id/eprint/7546/7/Genomic%20Analyses%20of%20Pre-European%20Conquest.pdf,11,https://github.com/DReichLab/EIG,github.com/DReichLab/EIG,DReichLab/EIG,2017-10-26,2017.0,researchonline.ljmu.ac.uk
Genomic Analyses of Pre-European Conquest Human Remains from the Canary Islands Reveal Close Affinity to Modern North Africans,R Rodríguez-Varela,https://researchonline.ljmu.ac.uk/id/eprint/7546/7/Genomic%20Analyses%20of%20Pre-European%20Conquest.pdf,11,https://github.com/DReichLab/AdmixTools,github.com/DReichLab/AdmixTools,DReichLab/AdmixTools,2017-10-26,2017.0,researchonline.ljmu.ac.uk
A kilonova as the electromagnetic counterpart to a gravitational-wave source,SJ Smartt,https://researchonline.ljmu.ac.uk/id/eprint/8626/1/1710.05841v2.pdf,37,https://github.com/mcoughlin/gwemlightcurves.,github.com/mcoughlin/gwemlightcurves,mcoughlin/gwemlightcurves,2017-10-16,2017.0,researchonline.ljmu.ac.uk
The Emergence of a Lanthanide-rich Kilonova Following the Merger of Two Neutron Stars,NR Tanvir,https://researchonline.ljmu.ac.uk/id/eprint/7488/1/The%20Emergence%20of%20a%20Lanthanide-rich%20Kilonova%20Following%20the%20Merger%20of%20Two%20Neutron%20Stars.pdf,5,https://github.com/gbrammer/grizli;,github.com/gbrammer/grizli,gbrammer/grizli,2017-10-16,2017.0,researchonline.ljmu.ac.uk
A Reverse Shock and Unusual Radio Properties in GRB 160625B,KD Alexander,https://researchonline.ljmu.ac.uk/id/eprint/7445/8/A%20Reverse%20Shock%20and%20Unusual%20Radio%20Properties%20in%20GRB%20160625B.pdf,5,https://github.com/pkgw/pwkit.,github.com/pkgw/pwkit,pkgw/pwkit,2017-10-12,2017.0,researchonline.ljmu.ac.uk
Investigating the diversity of supernovae type Iax: a MUSE and NOT spectroscopic study of their environments,JD Lyman,https://researchonline.ljmu.ac.uk/id/eprint/7692/1/stx2414.pdf,4,https://github.com/Lyalpha/ifuanal,github.com/Lyalpha/ifuanal,Lyalpha/ifuanal,2017-09-19,2017.0,researchonline.ljmu.ac.uk
The formation of high-mass stars and stellar clusters in the extreme environment of the Central Molecular Zone,DL Walker,https://researchonline.ljmu.ac.uk/id/eprint/6949/1/2017walkerphd.pdf,114,https://github.com/xinglunju/FFTL.,github.com/xinglunju/FFTL,xinglunju/FFTL,2017-09-11,2017.0,researchonline.ljmu.ac.uk
The formation of high-mass stars and stellar clusters in the extreme environment of the Central Molecular Zone,DL Walker,https://researchonline.ljmu.ac.uk/id/eprint/6949/1/2017walkerphd.pdf,117,https://github.com/xinglunju/emanon,github.com/xinglunju/emanon,xinglunju/emanon,2017-09-11,2017.0,researchonline.ljmu.ac.uk
Spatiotemporal Dynamics of Genetic Variation in the Iberian Lynx along Its Path to Extinction Reconstructed with Ancient DNA,M Casas-Marce,https://researchonline.ljmu.ac.uk/id/eprint/10317/1/Spatiotemporal%20Dynamics%20of%20Genetic%20Variation%20in%20the%20Iberian%20Lynx%20along%20Its%20Path%20to%20Extinction%20Reconstructed%20with%20Ancient%20DNA.pdf,13,https://github.com/bwlewis/rthreejs/blob/master/R/threejs.,github.com/bwlewis/rthreejs,bwlewis/rthreejs,2017-08-29,2017.0,researchonline.ljmu.ac.uk
Adding the s-Process Element Cerium to the APOGEE Survey: Identification and Characterization of Ce II Lines in the H-band Spectral Window,K Cunha,https://researchonline.ljmu.ac.uk/id/eprint/7933/1/Cunha_2017_ApJ_844_145.pdf,2,https://github.com/callendeprieto/ferre.,github.com/callendeprieto/ferre,callendeprieto/ferre,2017-08-01,2017.0,researchonline.ljmu.ac.uk
The population genomics of archaeological transition in west Iberia: Investigation of ancient substructure using imputation and haplotype-based methods,R Martiniano,https://researchonline.ljmu.ac.uk/id/eprint/13314/1/The%20population%20genomics%20of%20archaeological%20transition%20in%20west%20Iberia%20Investigation%20of%20ancient%20substructure%20using%20imputation%20a.pdf,14,"https://github.com/23andMe/yhaplo,",github.com/23andMe/yhaplo,23andMe/yhaplo,2017-07-27,2017.0,researchonline.ljmu.ac.uk
The Nearby Type Ibn Supernova 2015G: Signatures of Asymmetry and Progenitor Constraints,I Shivvers,https://researchonline.ljmu.ac.uk/id/eprint/6796/1/The%20Nearby%20Type%20Ibn%20Supernova%202015G.pdf,5,https://github.com/ishivvers/TheKastShiv,github.com/ishivvers/TheKastShiv,ishivvers/TheKastShiv,2017-07-26,2017.0,researchonline.ljmu.ac.uk
The age-metallicity structure of the Milky Way disc using APOGEE,JT Mackereth,https://researchonline.ljmu.ac.uk/id/eprint/7930/1/the_age-metallicity_structure_of_the_milky_way_disc_using_APOGEE.pdf,6,https://github.com/jobovy/apogee-maps,github.com/jobovy/apogee-maps,jobovy/apogee-maps,2017-07-14,2017.0,researchonline.ljmu.ac.uk
The age-metallicity structure of the Milky Way disc using APOGEE,JT Mackereth,https://researchonline.ljmu.ac.uk/id/eprint/7930/1/the_age-metallicity_structure_of_the_milky_way_disc_using_APOGEE.pdf,7,https://github.com/jobovy/apogee.,github.com/jobovy/apogee,jobovy/apogee,2017-07-14,2017.0,researchonline.ljmu.ac.uk
"A comparison of observed and simulated absorption from HI, C IV, and Si IV around z approximate to 2 star-forming galaxies suggests redshift-space distortions are due to inflows",ML Turner,https://researchonline.ljmu.ac.uk/id/eprint/7169/1/turner.pdf,2,http://github.com/turnerm/podpy.,github.com/turnerm/podpy,turnerm/podpy,2017-06-30,2017.0,researchonline.ljmu.ac.uk
"Sloan Digital Sky Survey IV: Mapping the Milky Way, Nearby Galaxies, and the Distant Universe",MR Blanton,https://researchonline.ljmu.ac.uk/id/eprint/7935/1/Blanton_2017_AJ_154_28.pdf,17,http://github.com/callendeprieto/ferre,github.com/callendeprieto/ferre,callendeprieto/ferre,2017-06-29,2017.0,researchonline.ljmu.ac.uk
The separate and combined effects of baryon physics and neutrino free-streaming on large-scale structure,BO Mummery,https://researchonline.ljmu.ac.uk/id/eprint/6748/1/nuAGN.pdf,4,https://github.com/sbird/S-GenIC,github.com/sbird/S-GenIC,sbird/S-GenIC,2017-06-20,2017.0,researchonline.ljmu.ac.uk
The separate and combined effects of baryon physics and neutrino free-streaming on large-scale structure,BO Mummery,https://researchonline.ljmu.ac.uk/id/eprint/6748/1/nuAGN.pdf,14,https://github.com/sbird/GenPK,github.com/sbird/GenPK,sbird/GenPK,2017-06-20,2017.0,researchonline.ljmu.ac.uk
How to bend galaxy disc profiles - II. Stars surfing the bar in Type-III discs,J Herpich,https://researchonline.ljmu.ac.uk/id/eprint/7276/7/How%20to%20bend%20galaxy%20disc%20profiles%20-%20II.%20Stars%20surfing%20the%20bar%20in%20Type-III%20discs.pdf,3,https://github.com/jakobherpich/pyICs.,github.com/jakobherpich/pyICs,jakobherpich/pyICs,2017-06-17,2017.0,researchonline.ljmu.ac.uk
Galaxy And Mass Assembly (GAMA): 'No Smoking' zone for giant elliptical galaxies?,HG Khosroshahi,https://researchonline.ljmu.ac.uk/id/eprint/6441/1/1704.09029v1.pdf,7,https://github.com/mojtabaraouf/sage.,github.com/mojtabaraouf/sage,mojtabaraouf/sage,2017-06-15,2017.0,researchonline.ljmu.ac.uk
On Self Organising Cyberdynamic Policy,MR Evans,https://researchonline.ljmu.ac.uk/id/eprint/6713/1/2017evansphd.pdf,241,https://github.com/KevinStern/software-and-,github.com/KevinStern/software-and-,KevinStern/software-and-algorithms,2017-06-11,2017.0,researchonline.ljmu.ac.uk
The evolution of superluminous supernova LSQ14mo and its interacting host galaxy system,TW Chen,https://researchonline.ljmu.ac.uk/id/eprint/7372/1/The_evolution_of_superluminous_supernova_LSQ14mo_and_its_interacting_host_galaxy_system.pdf,7,https://github.com/mnicholl/astro-scripts/blob/,github.com/mnicholl/astro-scripts,mnicholl/astro-scripts,2017-05-24,2017.0,researchonline.ljmu.ac.uk
The Gaia-ESO Survey: Structural and dynamical properties of the young cluster Chamaeleon I,GG Sacco,https://researchonline.ljmu.ac.uk/id/eprint/5542/1/1701.03741v1.pdf,10,https://github.com/MichielCottaar/velbin.,github.com/MichielCottaar/velbin,MichielCottaar/velbin,2017-05-10,2017.0,researchonline.ljmu.ac.uk
Modelling Low Power Compute Clusters for Cloud Simulation,G Kecskemeti,https://researchonline.ljmu.ac.uk/id/eprint/5081/1/RPi-PDP17.pdf,3,https://github.com/kecskemeti/dissect-cf,github.com/kecskemeti/dissect-cf,kecskemeti/dissect-cf,2017-04-27,2017.0,researchonline.ljmu.ac.uk
Maximizing survey volume for large-area multi-epoch surveys with Voronoi tessellation,MC Lam,https://researchonline.ljmu.ac.uk/id/eprint/9505/7/Maximizing%20survey%20volume%20for%20large-area%20multi-epoch%20surveys%20with%20Voronoi%20tessellation.pdf,2,https://github.com/tylerjereddy/py_sphere_Voronoi,github.com/tylerjereddy/py_sphere_Voronoi,tylerjereddy/py_sphere_Voronoi,2017-04-12,2017.0,researchonline.ljmu.ac.uk
Predictions for the detection of tidal streams with Gaia using great-circle methods,C Mateu,https://researchonline.ljmu.ac.uk/id/eprint/6738/3/stx872.pdf,5,https://github.com/mromerog/Gaia-errors,github.com/mromerog/Gaia-errors,mromerog/Gaia-errors,2017-04-10,2017.0,researchonline.ljmu.ac.uk
Predictions for the detection of tidal streams with Gaia using great-circle methods,C Mateu,https://researchonline.ljmu.ac.uk/id/eprint/6738/3/stx872.pdf,7,https://github.com/cmateu/PyMGC3,github.com/cmateu/PyMGC,cmateu/PyMGC3,2017-04-10,2017.0,researchonline.ljmu.ac.uk
The Molecular Gas Environment in the 20 KMS−1 Cloud in the Central Molecular Zone,X Lu,https://researchonline.ljmu.ac.uk/id/eprint/6151/1/1703.06551v1.pdf,9,https://github.com/fjdu/myRadex,github.com/fjdu/myRadex,fjdu/myRadex,2017-04-06,2017.0,researchonline.ljmu.ac.uk
Flexible Representation of IoT Sensors for Cloud Simulators,A Markus,https://researchonline.ljmu.ac.uk/id/eprint/5349/1/paper.pdf,1,https://github.com/kecskemeti/dissect-cf,github.com/kecskemeti/dissect-cf,kecskemeti/dissect-cf,2017-03-08,2017.0,researchonline.ljmu.ac.uk
Flexible Representation of IoT Sensors for Cloud Simulators,A Markus,https://researchonline.ljmu.ac.uk/id/eprint/5349/1/paper.pdf,2,https://github.com/andrasmarkus/dissect-cf/,github.com/andrasmarkus/dissect-cf,andrasmarkus/dissect-cf,2017-03-08,2017.0,researchonline.ljmu.ac.uk
Seven temperate terrestrial planets around the nearby ultracool dwarf star TRAPPIST-1,M Gillon,https://researchonline.ljmu.ac.uk/id/eprint/6410/1/1703.01424.pdf,16,"https://github.com/kdeck/TTVFast,",github.com/kdeck/TTVFast,kdeck/TTVFast,2017-02-23,2017.0,researchonline.ljmu.ac.uk
Seven temperate terrestrial planets around the nearby ultracool dwarf star TRAPPIST-1,M Gillon,https://researchonline.ljmu.ac.uk/id/eprint/6410/1/1703.01424.pdf,16,"https://github.com/ericagol/TTVFaster,",github.com/ericagol/TTVFaster,ericagol/TTVFaster,2017-02-23,2017.0,researchonline.ljmu.ac.uk
Seven temperate terrestrial planets around the nearby ultracool dwarf star TRAPPIST-1,M Gillon,https://researchonline.ljmu.ac.uk/id/eprint/6410/1/1703.01424.pdf,16,https://github.com/smirik/mercury.,github.com/smirik/mercury,smirik/mercury,2017-02-23,2017.0,researchonline.ljmu.ac.uk
A hybrid algorithm for a vehicle routing problem with realistic constraints,D Zhang,https://researchonline.ljmu.ac.uk/id/eprint/6136/1/V1A%20hybrid%20algorithm%20for%20a%20VehicleRouting%20Problem_Thanh_no_track_changes.pdf,16,https://github.com/maomiT/VRPTWP,github.com/maomiT/VRPTWP,maomiT/VRPTWP,2017-02-15,2017.0,researchonline.ljmu.ac.uk
The-wiZZ: Clustering redshift estimation for everyone,CB Morrison,https://researchonline.ljmu.ac.uk/id/eprint/5477/1/1609.09085.pdf,1,http://github.com/morriscb/The-wiZZ/.,github.com/morriscb/The-wiZZ,morriscb/The-wiZZ,2017-02-09,2017.0,researchonline.ljmu.ac.uk
The-wiZZ: Clustering redshift estimation for everyone,CB Morrison,https://researchonline.ljmu.ac.uk/id/eprint/5477/1/1609.09085.pdf,2,http://github.com/ryanscranton/astro-stomp/,github.com/ryanscranton/astro-stomp,ryanscranton/astro-stomp,2017-02-09,2017.0,researchonline.ljmu.ac.uk
Leverage a Trust Service Platform for Data Usage Control in Smart City,GM Lee,https://researchonline.ljmu.ac.uk/id/eprint/4057/1/Camera_ready_version_PID1184810.pdf,3,https://github.com/complexible/pellet,github.com/complexible/pellet,complexible/pellet,2017-02-06,2017.0,researchonline.ljmu.ac.uk
Cosmology with Velocity Dispersion based Counts of Groups and the Effect of AGN Feedback on Host Galaxy Morphology,CE Caldwell,https://researchonline.ljmu.ac.uk/id/eprint/5261/1/2016caldwellphd.pdf,30,https://github.com/sbird/S-GenIC,github.com/sbird/S-GenIC,sbird/S-GenIC,2017-01-11,2017.0,researchonline.ljmu.ac.uk
nIFTy galaxy cluster simulations - V. Investigation of the cluster infall region,J Arthur,https://researchonline.ljmu.ac.uk/id/eprint/6254/1/stw2424.pdf,4,"https://github.com/pelahi/VELOCIraptor-STF.git),",github.com/pelahi/VELOCIraptor-STF,pelahi/VELOCIraptor-STF,2017-01-01,2017.0,researchonline.ljmu.ac.uk
Genomic Signatures of Historical Allopatry and Ecological Divergence in an Island Lizard,RP Brown,https://researchonline.ljmu.ac.uk/id/eprint/5245/1/Genome%20Biol%20Evol-2016-Brown-3618-26.pdf,2,https://github.com/tcezard/RADmapper),github.com/tcezard/RADmapper,tcezard/RADmapper,2016-12-31,2016.0,researchonline.ljmu.ac.uk
Extreme genomic erosion after recurrent demographic bottlenecks in the highly endangered Iberian lynx,F Abascal,https://researchonline.ljmu.ac.uk/id/eprint/9288/1/Extreme%20genomic%20erosion%20after%20recurrent.pdf,14,https://github.com/mailund/IMCoalHMM.,github.com/mailund/IMCoalHMM,mailund/IMCoalHMM,2016-12-14,2016.0,researchonline.ljmu.ac.uk
CFHTLenS revisited: assessing concordance with Planck including astrophysical systematics,S Joudaki,https://researchonline.ljmu.ac.uk/id/eprint/13356/1/CFHTLenS%20revisited%20assessing%20concordance%20with%20Planck%20including%20astrophysical%20systematics.pdf,1,https://github.com/sjoudaki/cfhtlens_revisited.,github.com/sjoudaki/cfhtlens_revisited,sjoudaki/cfhtlens_revisited,2016-12-09,2016.0,researchonline.ljmu.ac.uk
CFHTLenS revisited: assessing concordance with Planck including astrophysical systematics,S Joudaki,https://researchonline.ljmu.ac.uk/id/eprint/13356/1/CFHTLenS%20revisited%20assessing%20concordance%20with%20Planck%20including%20astrophysical%20systematics.pdf,3,https://github.com/alexander-mead/hmcode,github.com/alexander-mead/hmcode,alexander-mead/hmcode,2016-12-09,2016.0,researchonline.ljmu.ac.uk
2dFLenS and KiDS: determining source redshift distributions with cross-correlations,A Johnson,https://researchonline.ljmu.ac.uk/id/eprint/13355/1/2dFLenS%20and%20KiDS%20determining%20source%20redshift%20distributions%20with%20cross-correlations.pdf,6,https://github.com/morriscb/chomp,github.com/morriscb/chomp,morriscb/chomp,2016-11-23,2016.0,researchonline.ljmu.ac.uk
Scalable Daily Human Behavioral Pattern Mining from Multivariate Temporal Data,R Rawassizadeh,https://researchonline.ljmu.ac.uk/id/eprint/3926/1/TKDE%204%20CD%20FINAL.pdf,4,https://github.com/rezar/ubiqlog,github.com/rezar/ubiqlog,rezar/ubiqlog,2016-11-01,2016.0,researchonline.ljmu.ac.uk
Observations of metals in the z approximate to 3.5 intergalactic medium and comparison to the EAGLE simulations,ML Turner,https://researchonline.ljmu.ac.uk/id/eprint/4710/1/MNRAS-2016-Turner-2440-64.pdf,2,https://github.com/turnerm/podpy.,github.com/turnerm/podpy,turnerm/podpy,2016-11-01,2016.0,researchonline.ljmu.ac.uk
The BAHAMAS project: Calibrated hydrodynamical simulations for large-scale structure cosmology,IG McCarthy,https://researchonline.ljmu.ac.uk/id/eprint/5238/1/MNRAS-2017-McCarthy-2936-65.pdf,2,https://github.com/sbird/S-GenIC,github.com/sbird/S-GenIC,sbird/S-GenIC,2016-10-30,2016.0,researchonline.ljmu.ac.uk
